<?xml version="1.0" encoding="UTF-8"?>
<!--
  Copyright (C) 2020 Stefan Sedelmaier
  
  This program is free software: you can redistribute it and/or modify
  it under the terms of the GNU Affero General Public License as published
  by the Free Software Foundation, either version 3 of the License, or
  (at your option) any later version.
  
  This program is distributed in the hope that it will be useful,
  but WITHOUT ANY WARRANTY; without even the implied warranty of
  MERCHANTABILITY or FITNESS FOR A PARTICULAR PURPOSE.  See the
  GNU Affero General Public License for more details.
  
  You should have received a copy of the GNU Affero General Public License
  along with this program. If not, see <http://www.gnu.org/licenses/>.
-->
<pm:process
    xmlns:xsi='http://www.w3.org/2001/XMLSchema-instance'
    xmlns:pm='http://api.opensbpm.org/processmodel'
    xsi:schemaLocation='http://api.opensbpm.org/processmodel
        file:/home/stefan/src/opensbpm/engine/api/src/main/resources/xsd/processmodel.xsd'>
    <!-- xmllint - -schema ../../main/resources/xsd/processmodel.xsd sampleValidatingModel.xml -->
    <name>ProcessModel</name>
    <version>1</version>
    <description>Descriotn</description>
    <!--state>INACTIVE</state-->
    <userSubject starter="true">
        <name>Subject</name>
        <functionState eventType="START">
            <name>Start</name>
            <!--
        <permission>
            <object name="">
                <field name="" type=""></field>
                <field name="" type=""></field>
                <field name="" type=""></field>
            </object>
            <field permission="" mandatory=""></field>
        </permission>
        <toState></toState>
            -->
        </functionState>
        <sendState async="true">
            <name>A Send</name>
            <receiver>Subject 1</receiver>
            <message>My Object</message>
            <toState>Ende</toState>
        </sendState>        
        <functionState eventType="END">
            <name>End</name>
        </functionState>
        <roles>Rolle</roles>
    </userSubject>

    <serviceSubject>
        <name>Subject 1</name>
        <functionState eventType="END">
            <name>End</name>
        </functionState>
    </serviceSubject>
        
    <object>
        <name>My Object</name>
    </object>
</pm:process>
